<?xml version="1.0" encoding="UTF-8"?>
<!DOCTYPE root SYSTEM "hwloc.dtd">
<root complete_cpuset="0x0001915b" online_cpuset="0x0000905b" allowed_cpuset="0x0000915b">
  <object type="System" os_level="-1" os_index="0" cpuset="0x0000905b" dmi_board_vendor="" dmi_board_name="" memory_kB="0" huge_page_free="0" huge_page_size_kB="0">
    <object type="Socket" os_level="-1" os_index="0" cpuset="0x00001011">
      <object type="Cache" os_level="-1" os_index="-1" cpuset="0x00001011" memory_kB="4096" depth="3">
        <object type="Cache" os_level="-1" os_index="-1" cpuset="0x00000001" memory_kB="1024" depth="2">
          <object type="Cache" os_level="-1" os_index="-1" cpuset="0x00000001" memory_kB="16" depth="1">
            <object type="Core" os_level="-1" os_index="0" cpuset="0x00000001">
              <object type="Proc" os_level="-1" os_index="0" cpuset="0x00000001"/>
            </object>
          </object>
        </object>
        <object type="Cache" os_level="-1" os_index="-1" cpuset="0x00001010" memory_kB="1024" depth="2">
          <object type="Cache" os_level="-1" os_index="-1" cpuset="0x00001010" memory_kB="16" depth="1">
            <object type="Core" os_level="-1" os_index="1" cpuset="0x00001010">
              <object type="Proc" os_level="-1" os_index="4" cpuset="0x00000010"/>
              <object type="Proc" os_level="-1" os_index="12" cpuset="0x00001000"/>
            </object>
          </object>
        </object>
      </object>
    </object>
    <object type="Socket" os_level="-1" os_index="1" cpuset="0x00000002">
      <object type="Cache" os_level="-1" os_index="-1" cpuset="0x00000002" memory_kB="4096" depth="3">
        <object type="Cache" os_level="-1" os_index="-1" cpuset="0x00000002" memory_kB="1024" depth="2">
          <object type="Cache" os_level="-1" os_index="-1" cpuset="0x00000002" memory_kB="16" depth="1">
            <object type="Core" os_level="-1" os_index="0" cpuset="0x00000002">
              <object type="Proc" os_level="-1" os_index="1" cpuset="0x00000002"/>
            </object>
          </object>
        </object>
      </object>
    </object>
    <object type="Socket" os_level="-1" os_index="3" cpuset="0x00008008">
      <object type="Cache" os_level="-1" os_index="-1" cpuset="0x00008008" memory_kB="4096" depth="3">
        <object type="Cache" os_level="-1" os_index="-1" cpuset="0x00000008" memory_kB="1024" depth="2">
          <object type="Cache" os_level="-1" os_index="-1" cpuset="0x00000008" memory_kB="16" depth="1">
            <object type="Core" os_level="-1" os_index="0" cpuset="0x00000008">
              <object type="Proc" os_level="-1" os_index="3" cpuset="0x00000008"/>
            </object>
          </object>
        </object>
        <object type="Cache" os_level="-1" os_index="-1" cpuset="0x00008000" memory_kB="1024" depth="2">
          <object type="Cache" os_level="-1" os_index="-1" cpuset="0x00008000" memory_kB="16" depth="1">
            <object type="Core" os_level="-1" os_index="1" cpuset="0x00008000">
              <object type="Proc" os_level="-1" os_index="15" cpuset="0x00008000"/>
            </object>
          </object>
        </object>
      </object>
    </object>
    <object type="Socket" os_level="-1" os_index="2" cpuset="0x00000040">
      <object type="Cache" os_level="-1" os_index="-1" cpuset="0x00000040" memory_kB="4096" depth="3">
        <object type="Cache" os_level="-1" os_index="-1" cpuset="0x00000040" memory_kB="1024" depth="2">
          <object type="Cache" os_level="-1" os_index="-1" cpuset="0x00000040" memory_kB="16" depth="1">
            <object type="Core" os_level="-1" os_index="1" cpuset="0x00000040">
              <object type="Proc" os_level="-1" os_index="6" cpuset="0x00000040"/>
            </object>
          </object>
        </object>
      </object>
    </object>
  </object>
</root>
